name,age,secretIdentity,powers,squadName,homeTown,formed,secretBase,active
the dad,45,peter,"strong, old, neat",The incredibles,Nashville,1989,Edgefield Tavern,False
megan,98.6,mckinsey,"excel, powerpoint, jargon, frequent flyer miles",The incredibles,Nashville,1989,Edgefield Tavern,False
Molecule Man,29,Dan Jukes,"Radiation resistance, Turning tiny, Radiation blast",Super hero squad,Metro City,2016,Super tower,True
Madame Uppercut,39,Jane Wilson,"Million tonne punch, Damage resistance, Superhuman reflexes",Super hero squad,Metro City,2016,Super tower,True
Eternal Flame,1000000,Unknown,"Immortality, Heat Immunity, Inferno, Teleportation, Interdimensional travel",Super hero squad,Metro City,2016,Super tower,True
